### ISSUE TITLE
"Scale request failed: socket hang up"

### ISSUE THREAD

**Issue by BasadoBased** [agnaistic/agnai#86]
Hi, this issue might be too specific to fix so feel free to close it.

When I reroute the docker container's traffic through a vpn container (gluetun), all requests fail like this. I went into this container's commandline and was able to reach debian's servers through apt without an issue. I should add that the scale URL and key work fine on the officially hosted version of agnai.

**Comment by sandwichdoge** [comment]
What happens when you ping the scale endpoint from your app container's terminal?
```
ping dashboard.scale.com
```
Edit: the container doesn't have ping, you can install it with 
```
apt-get update -y
apt-get install -y iputils-ping
```

**Comment by BasadoBased** [comment]
Ping goes through correctly:
PING dashboard.scale.com (104.18.12.136) 56(84) bytes of data.

64 bytes from 104.18.12.136 (104.18.12.136): icmp_seq=1 ttl=60 time=320 ms
64 bytes from 104.18.12.136 (104.18.12.136): icmp_seq=2 ttl=60 time=217 ms
64 bytes from 104.18.12.136 (104.18.12.136): icmp_seq=3 ttl=60 time=362 ms
64 bytes from 104.18.12.136 (104.18.12.136): icmp_seq=4 ttl=60 time=290 ms
64 bytes from 104.18.12.136 (104.18.12.136): icmp_seq=5 ttl=60 time=374 ms

Very strange.

**Comment by sceuick** [comment]
I've seen this locally and deployed.
In the request logs I often see 502s from Scale as well. I'd wager that it's simply their servers being too busy to accept a connection.
If your connection request gets routed to a server that has no available file handles to accept that connection, you're probably going to a socket hang up because they didn't accept the request in a timely manner. 

Guessing by the 502s I see, they have instances that fail health checks and get taken out of service.
If for example they're using something like AWS ECS and their API is their "primary/essential task", it'd effectively take down that entire ECS cluster and restart it thus the bad gateway.

This would kinda make sense since they use an API design that has extremely long running requests.

**Comment by BasadoBased** [comment]
I suppose that's possible? Although my intuition is that this is somehow related to node. My reasoning:
- I tried this yesterday and same result as today. I've tried many times at different times and no luck
- Running tavern on my desktop, but routing my whole desktop through the VPN always works. Same key

This might be too much effort to track down and solve though, VPN docker containers are kinda niche. Unfortunately I don't  have any services other than Scale I could test on to see if its all services or just scale.

**Comment by sceuick** [comment]
How quickly does the request fail?
You could try the Horde adapter using no API key.

**Comment by sandwichdoge** [comment]
@BasadoBased Please run this cmd in the gluetun container, then try and make some requests with the Scale API. Let's see some more logs.
```
tcpdump -i any tcp and host 104.18.12.136
```

**Comment by BasadoBased** [comment]
I timed it at 19 seconds from the moment I send a message to when the socket hang up appears in the log.

One moment, it abruptly worked for a moment then broke again while I was gathering that tcpdump. I'm poking around to find out what's happening. Horde is broken inside the vpn but works outside it. I'm going to try a bunch of things real quick and write up my findings

**Comment by BasadoBased** [comment]
Alright, here's what happened:
- Tried horde inside vpn container - failed
- Took the whole thing outside of the vpn and tried horde - working
- Put it back in, failed once then suddenly Scale worked a single time and I have never seen it work again from inside the vpn - I attribute this success to divine providence or hallucination

So currently all services work outside the vpn and fail inside. Here is the tcpdump of trying scale from inside the vpn, I had to set it to verbose to get anything. Note this run was a socket hangup.
```
14:01:29.754484 tun0  Out IP (tos 0x0, ttl 64, id 16515, offset 0, flags [DF], proto TCP (6), length 60)
    10.66.220.77.60926 > 104.18.12.136.443: Flags [S], cksum 0x5b58 (incorrect -> 0x6f33), seq 632044985, win 64860, options [mss 1380,sackOK,TS val 784137914 ecr 0,nop,wscale 7], length 0
14:01:29.977728 tun0  In  IP (tos 0x0, ttl 60, id 0, offset 0, flags [DF], proto TCP (6), length 60)
    104.18.12.136.443 > 10.66.220.77.60926: Flags [S.], cksum 0x5f87 (correct), seq 730230698, ack 632044986, win 65160, options [mss 1380,sackOK,TS val 1847723286 ecr 784137914,nop,wscale 13], length 0
14:01:29.977797 tun0  Out IP (tos 0x0, ttl 64, id 16516, offset 0, flags [DF], proto TCP (6), length 52)
    10.66.220.77.60926 > 104.18.12.136.443: Flags [.], cksum 0x5b50 (incorrect -> 0x89b8), ack 1, win 507, options [nop,nop,TS val 784138137 ecr 1847723286], length 0
14:01:29.978425 tun0  Out IP (tos 0x0, ttl 64, id 16517, offset 0, flags [DF], proto TCP (6), length 429)
    10.66.220.77.60926 > 104.18.12.136.443: Flags [P.], cksum 0x5cc9 (incorrect -> 0x288c), seq 1:378, ack 1, win 507, options [nop,nop,TS val 784138137 ecr 1847723286], length 377
14:01:30.223288 tun0  In  IP (tos 0x0, ttl 60, id 34358, offset 0, flags [DF], proto TCP (6), length 52)
    104.18.12.136.443 > 10.66.220.77.60926: Flags [.], cksum 0x896b (correct), ack 378, win 8, options [nop,nop,TS val 1847723485 ecr 784138137], length 0
14:01:30.225747 tun0  In  IP (tos 0x0, ttl 60, id 34359, offset 0, flags [DF], proto TCP (6), length 1420)
    104.18.12.136.443 > 10.66.220.77.60926: Flags [.], cksum 0x2246 (correct), seq 1:1369, ack 378, win 8, options [nop,nop,TS val 1847723491 ecr 784138137], length 1368
14:01:30.225778 tun0  Out IP (tos 0x0, ttl 64, id 16518, offset 0, flags [DF], proto TCP (6), length 52)
    10.66.220.77.60926 > 104.18.12.136.443: Flags [.], cksum 0x5b50 (incorrect -> 0x8127), ack 1369, win 502, options [nop,nop,TS val 784138385 ecr 1847723491], length 0
14:01:30.228621 tun0  In  IP (tos 0x0, ttl 60, id 34360, offset 0, flags [DF], proto TCP (6), length 1310)
    104.18.12.136.443 > 10.66.220.77.60926: Flags [P.], cksum 0xe301 (correct), seq 1369:2627, ack 378, win 8, options [nop,nop,TS val 1847723491 ecr 784138137], length 1258
14:01:30.228651 tun0  Out IP (tos 0x0, ttl 64, id 16519, offset 0, flags [DF], proto TCP (6), length 52)
    10.66.220.77.60926 > 104.18.12.136.443: Flags [.], cksum 0x5b50 (incorrect -> 0x7c3a), ack 2627, win 502, options [nop,nop,TS val 784138388 ecr 1847723491], length 0
14:01:30.234952 tun0  Out IP (tos 0x0, ttl 64, id 16520, offset 0, flags [DF], proto TCP (6), length 1513)
    10.66.220.77.60926 > 104.18.12.136.443: Flags [P.], cksum 0x6105 (incorrect -> 0x55eb), seq 378:1839, ack 2627, win 502, options [nop,nop,TS val 784138394 ecr 1847723491], length 1461
14:01:30.457147 tun0  In  IP (tos 0x0, ttl 60, id 34361, offset 0, flags [DF], proto TCP (6), length 64)
    104.18.12.136.443 > 10.66.220.77.60926: Flags [.], cksum 0x724d (correct), ack 378, win 8, options [nop,nop,TS val 1847723739 ecr 784138388,nop,nop,sack 1 {1746:1839}], length 0
14:01:30.524090 tun0  Out IP (tos 0x0, ttl 64, id 16522, offset 0, flags [DF], proto TCP (6), length 1420)
    10.66.220.77.60926 > 104.18.12.136.443: Flags [.], cksum 0x60a8 (incorrect -> 0x5adc), seq 378:1746, ack 2627, win 502, options [nop,nop,TS val 784138683 ecr 1847723739], length 1368
14:01:31.208104 tun0  Out IP (tos 0x0, ttl 64, id 16523, offset 0, flags [DF], proto TCP (6), length 1420)
    10.66.220.77.60926 > 104.18.12.136.443: Flags [.], cksum 0x60a8 (incorrect -> 0x5830), seq 378:1746, ack 2627, win 502, options [nop,nop,TS val 784139367 ecr 1847723739], length 1368
14:01:32.584110 tun0  Out IP (tos 0x0, ttl 64, id 16524, offset 0, flags [DF], proto TCP (6), length 1420)
    10.66.220.77.60926 > 104.18.12.136.443: Flags [.], cksum 0x60a8 (incorrect -> 0x52d0), seq 378:1746, ack 2627, win 502, options [nop,nop,TS val 784140743 ecr 1847723739], length 1368
14:01:35.528118 tun0  Out IP (tos 0x0, ttl 64, id 16525, offset 0, flags [DF], proto TCP (6), length 1420)
    10.66.220.77.60926 > 104.18.12.136.443: Flags [.], cksum 0x60a8 (incorrect -> 0x4750), seq 378:1746, ack 2627, win 502, options [nop,nop,TS val 784143687 ecr 1847723739], length 1368
14:01:41.160121 tun0  Out IP (tos 0x0, ttl 64, id 16526, offset 0, flags [DF], proto TCP (6), length 1420)
    10.66.220.77.60926 > 104.18.12.136.443: Flags [.], cksum 0x60a8 (incorrect -> 0x3150), seq 378:1746, ack 2627, win 502, options [nop,nop,TS val 784149319 ecr 1847723739], length 1368
14:01:45.183688 tun0  In  IP (tos 0x0, ttl 60, id 34362, offset 0, flags [DF], proto TCP (6), length 64)
    104.18.12.136.443 > 10.66.220.77.60926: Flags [F.], cksum 0x38bb (correct), seq 2627, ack 378, win 8, options [nop,nop,TS val 1847738476 ecr 784138388,nop,nop,sack 1 {1746:1839}], length 0
14:01:45.184754 tun0  Out IP (tos 0x0, ttl 64, id 16527, offset 0, flags [DF], proto TCP (6), length 52)
    10.66.220.77.60926 > 104.18.12.136.443: Flags [F.], cksum 0x5b50 (incorrect -> 0x018e), seq 1839, ack 2628, win 502, options [nop,nop,TS val 784153344 ecr 1847738476], length 0
14:01:45.419278 tun0  In  IP (tos 0x0, ttl 60, id 0, offset 0, flags [DF], proto TCP (6), length 40)
    104.18.12.136.443 > 10.66.220.77.60926: Flags [R], cksum 0xbf88 (correct), seq 730233326, win 0, length 0
```

**Comment by sandwichdoge** [comment]
@BasadoBased This sounds weird but on your app container, try lowering the MTU of the outbound network interface to 1380
```
ifconfig <Interface_name> mtu <mtu_size> up
```

This line indicates that the packet the gluetun router was a little too big, with DF flag set. That packet will be dropped instead of fragmented.
```
14:01:30.234952 tun0  Out IP (tos 0x0, ttl 64, id 16520, offset 0, flags [DF], proto TCP (6), length 1513)
    10.66.220.77.60926 > 104.18.12.136.443: Flags [P.], cksum 0x6105 (incorrect -> 0x55eb), seq 378:1839, ack 2627, win 502, options [nop,nop,TS val 784138394 ecr 1847723491], length 1461
```

**Comment by BasadoBased** [comment]
By app container you mean agnaistic right? Getting some weird errors trying to do that even though I'm root:
> ifconfig tun0 mtu 1380 up
SIOCSIFMTU: Operation not permitted
SIOCSIFFLAGS: Operation not permitted

Chatgpt said to try this other command, but similar error:
> ip link set dev tun0 mtu 1380
RTNETLINK answers: Operation not permitted

I'll keep fiddling with it...

**Comment by sandwichdoge** [comment]
@BasadoBased Are you sure you're running it on the agnai app container? It should be eth0 not tun0, unless your vpn setup modifies the app container.

**Comment by BasadoBased** [comment]
Same error with eth0, running from agnai's container commandline

**Comment by BasadoBased** [comment]
Here are the current MTU values from ifconfig:

```
/app# ifconfig
eth0: flags=4163<UP,BROADCAST,RUNNING,MULTICAST>  mtu 1500
        inet 192.168.96.2  netmask 255.255.240.0  broadcast 192.168.111.255
        inet6 fe80::42:c0ff:fea8:6002  prefixlen 64  scopeid 0x20<link>
        ether 02:42:c0:a8:60:02  txqueuelen 0  (Ethernet)
        RX packets 83618  bytes 59363642 (56.6 MiB)
        RX errors 0  dropped 0  overruns 0  frame 0
        TX packets 92570  bytes 19630660 (18.7 MiB)
        TX errors 0  dropped 0 overruns 0  carrier 0  collisions 0

lo: flags=73<UP,LOOPBACK,RUNNING>  mtu 65536
        inet 127.0.0.1  netmask 255.0.0.0
        inet6 ::1  prefixlen 128  scopeid 0x10<host>
        loop  txqueuelen 1000  (Local Loopback)
        RX packets 190662  bytes 14064209 (13.4 MiB)
        RX errors 0  dropped 0  overruns 0  frame 0
        TX packets 190662  bytes 14064209 (13.4 MiB)
        TX errors 0  dropped 0 overruns 0  carrier 0  collisions 0

tun0: flags=209<UP,POINTOPOINT,RUNNING,NOARP>  mtu 1380
        inet 10.66.220.77  netmask 255.255.255.255  destination 10.66.220.77
        inet6 fc00:bbbb:bbbb:bb01::3:dc4c  prefixlen 128  scopeid 0x0<global>
        unspec 00-00-00-00-00-00-00-00-00-00-00-00-00-00-00-00  txqueuelen 0  (UNSPEC)
        RX packets 56769  bytes 46245956 (44.1 MiB)
        RX errors 0  dropped 0  overruns 0  frame 0
        TX packets 63044  bytes 6854672 (6.5 MiB)
        TX errors 0  dropped 0 overruns 0  carrier 0  collisions 0
```

**Comment by sandwichdoge** [comment]
Looks like you can't change MTU on the fly in Docker containers. There's a few ways to do it, I've only found one, tested and it works but it requires you to delete your current containers: https://mlohr.com/docker-mtu/
TLDR your self-host.docker-compose.yml file should look like this:
```
version: '2'

services:
  app:
    image: ghcr.io/luminai-companion/agnaistic:latest
    restart: always
    ports:
      - '3001:3001'
    environment:
      - DB_HOST=mongo
      - DB_PORT=27017
      - DB_NAME=agnai
      - INITIAL_USER=admin
      - INITIAL_PASSWORD=password
      - JWT_SECRET=self-hosting
    
  mongo:
    image: mongo:6
    restart: always
    ports:
      - '27017:27017'

networks:                                
  default:                               
    driver: bridge                       
    driver_opts:                         
      com.docker.network.driver.mtu: 1380
```

**Comment by BasadoBased** [comment]
OK, I set it up like so:
```
version: '2'

services:
  app:
    image: ghcr.io/luminai-companion/agnaistic:latest
    network_mode: "container:gluetun"
    #ports:
     # - '3002:3001' 
    environment:
      - DB_HOST=mongo
      - DB_PORT=27017
      - DB_NAME=agnai
      - INITIAL_USER=admin
      - INITIAL_PASSWORD=password
      - JWT_SECRET=self-hosting
    
  mongo:
    image: mongo:6
    network_mode: "container:gluetun"
    #ports:
     # - '27017:27017'
networks:                                
  default:                               
    driver: bridge                       
    driver_opts:                         
      com.docker.network.driver.mtu: 1380
```

However ifconfig now outputs:
```
# ifconfig
eth0: flags=4163<UP,BROADCAST,RUNNING,MULTICAST>  mtu 1500
        inet 192.168.96.2  netmask 255.255.240.0  broadcast 192.168.111.255
        inet6 fe80::42:c0ff:fea8:6002  prefixlen 64  scopeid 0x20<link>
        ether 02:42:c0:a8:60:02  txqueuelen 0  (Ethernet)
        RX packets 84191  bytes 59539425 (56.7 MiB)
        RX errors 0  dropped 0  overruns 0  frame 0
        TX packets 93375  bytes 19763524 (18.8 MiB)
        TX errors 0  dropped 0 overruns 0  carrier 0  collisions 0

lo: flags=73<UP,LOOPBACK,RUNNING>  mtu 65536
        inet 127.0.0.1  netmask 255.0.0.0
        inet6 ::1  prefixlen 128  scopeid 0x10<host>
        loop  txqueuelen 1000  (Local Loopback)
        RX packets 192784  bytes 14229539 (13.5 MiB)
        RX errors 0  dropped 0  overruns 0  frame 0
        TX packets 192784  bytes 14229539 (13.5 MiB)
        TX errors 0  dropped 0 overruns 0  carrier 0  collisions 0

tun0: flags=209<UP,POINTOPOINT,RUNNING,NOARP>  mtu 1580
        inet 10.66.220.77  netmask 255.255.255.255  destination 10.66.220.77
        inet6 fc00:bbbb:bbbb:bb01::3:dc4c  prefixlen 128  scopeid 0x0<global>
        unspec 00-00-00-00-00-00-00-00-00-00-00-00-00-00-00-00  txqueuelen 0  (UNSPEC)
        RX packets 57197  bytes 46374940 (44.2 MiB)
        RX errors 0  dropped 0  overruns 0  frame 0
        TX packets 63718  bytes 6944340 (6.6 MiB)
        TX errors 0  dropped 0 overruns 0  carrier 0  collisions 0
```
I think the gluetun network mode is complicating the situation?
I've been testing it each time a change has been made and nothing yet.

Also I'm really bad with networking but in the tcpdump line you picked out the DF don't fragment flag was set - could that be causing the issue?

**Comment by BasadoBased** [comment]
I think we should close this - its clearly outside the scope of this codebase. Also I tried adding that mtu line to gluetun's compose but i'm getting network not found errors and can't get the gluetun container to install now.

**Comment by sandwichdoge** [comment]
Ok so the latest ifconfig is on your agnai container, I see now. 
The idea is this, let's say your gluetun tun0's MTU is 1420. Your gluetun container is like a pipe, it's 1420mm in diameter. The NIC on your agnai container tries to push a 1580mm ball (packet) through it because its MTU is set to 1580. The DF flag is set, which means your gluetun will drop all balls bigger than 1420mm instead of dividing it into smaller ones. This DF flag is for SSL, we can't do anything about it.
What we're trying to do is limit the agnai container to push 1380mm balls only, through an even tunnel that's big enough.
You need to configure it so that the tun0 interfaces on your agnai container shares the same MTU as the one on your gluetun container, ideally 1380, as the tun0 interfaces must be smaller than their underlay interfaces to save room for VPN headers.

This is a common issue for VPN tunnels, but it's just my educated guess.
The setup on your local computer works because the NIC from which traffic goes out is already configured to have smaller/same MTU as the tunnel size.

**Comment by BasadoBased** [comment]
OK, I understand the issue now. After fixing my setup, I went into gluetun's commandline and used that MTU commandline from earlier. Surprisingly it appears to let you change the MTU. I set all MTUs to 1800. This is the ifconfig output of *gluetun* right now:
```
# ifconfig
eth0      Link encap:Ethernet  HWaddr 02:42:C0:A8:D0:02  
          inet addr:192.168.208.2  Bcast:192.168.223.255  Mask:255.255.240.0
          inet6 addr: fe80::42:c0ff:fea8:d002/64 Scope:Link
          UP BROADCAST RUNNING MULTICAST  MTU:1800  Metric:1
          RX packets:4916 errors:0 dropped:0 overruns:0 frame:0
          TX packets:3160 errors:0 dropped:0 overruns:0 carrier:0
          collisions:0 txqueuelen:0 
          RX bytes:5984893 (5.7 MiB)  TX bytes:493682 (482.1 KiB)

lo        Link encap:Local Loopback  
          inet addr:127.0.0.1  Mask:255.0.0.0
          inet6 addr: ::1/128 Scope:Host
          UP LOOPBACK RUNNING  MTU:65536  Metric:1
          RX packets:856 errors:0 dropped:0 overruns:0 frame:0
          TX packets:856 errors:0 dropped:0 overruns:0 carrier:0
          collisions:0 txqueuelen:1000 
          RX bytes:69546 (67.9 KiB)  TX bytes:69546 (67.9 KiB)

tun0      Link encap:UNSPEC  HWaddr 00-00-00-00-00-00-00-00-00-00-00-00-00-00-00-00  
          inet addr:10.66.220.77  P-t-P:10.66.220.77  Mask:255.255.255.255
          inet6 addr: fc00:bbbb:bbbb:bb01::3:dc4c/128 Scope:Global
          UP POINTOPOINT RUNNING NOARP  MTU:1800  Metric:1
          RX packets:4774 errors:0 dropped:0 overruns:0 frame:0
          TX packets:3084 errors:0 dropped:0 overruns:0 carrier:0
          collisions:0 txqueuelen:0 
          RX bytes:5751816 (5.4 MiB)  TX bytes:357204 (348.8 KiB)
```
However after resetting the agnai containers and trying again, they are unfortunately still not working

**Comment by sandwichdoge** [comment]
Can you set the eth0 to 1500 and tun0 to 1380?

**Comment by BasadoBased** [comment]
OK, set Gluetun's eth0 to 1500 and tun0 to 1380, confirmed they were set with ifconfig and redeployed agnai. Same issue still

**Comment by BasadoBased** [comment]
I'm going to be honest i'm a dumbass and ran the tcp dump from agnai. I'll try to get it again from gluetun but the container seems to not have a package manager. Edit it has apk, one minute

**Comment by sandwichdoge** [comment]
Alright please grab everything and summarize them here again (tcpdump, ifconfig setups on gluetun and agnai).
I'll have a look tomorrow.

**Comment by BasadoBased** [comment]
Thank you for your time.

**Run 1**
Trying to send a message to scale
tcp dump from gluetun:
```
# tcpdump -i any tcp and host 104.18.12.136
tcpdump: data link type LINUX_SLL2
tcpdump: verbose output suppressed, use -v[v]... for full protocol decode
listening on any, link-type LINUX_SLL2 (Linux cooked v2), snapshot length 262144 bytes
17:08:00.558092 tun0  Out IP 10.66.220.77.44138 > 104.18.12.136.443: Flags [S], seq 3292747545, win 64320, options [mss 1340,sackOK,TS val 795328717 ecr 0,nop,wscale 7], length 0
17:08:00.881298 tun0  In  IP 104.18.12.136.443 > 10.66.220.77.44138: Flags [S.], seq 1660485582, ack 3292747546, win 65160, options [mss 1380,sackOK,TS val 184389790 ecr 795328717,nop,wscale 13], length 0
17:08:00.881361 tun0  Out IP 10.66.220.77.44138 > 104.18.12.136.443: Flags [.], ack 1, win 503, options [nop,nop,TS val 795329040 ecr 184389790], length 0
17:08:00.882023 tun0  Out IP 10.66.220.77.44138 > 104.18.12.136.443: Flags [P.], seq 1:378, ack 1, win 503, options [nop,nop,TS val 795329041 ecr 184389790], length 377
17:08:01.114248 tun0  In  IP 104.18.12.136.443 > 10.66.220.77.44138: Flags [.], ack 378, win 8, options [nop,nop,TS val 184390060 ecr 795329041], length 0
17:08:01.114290 tun0  In  IP 104.18.12.136.443 > 10.66.220.77.44138: Flags [.], seq 1:1329, ack 378, win 8, options [nop,nop,TS val 184390069 ecr 795329041], length 1328
17:08:01.114307 tun0  Out IP 10.66.220.77.44138 > 104.18.12.136.443: Flags [.], ack 1329, win 502, options [nop,nop,TS val 795329273 ecr 184390069], length 0
17:08:01.119543 tun0  In  IP 104.18.12.136.443 > 10.66.220.77.44138: Flags [P.], seq 1329:2626, ack 378, win 8, options [nop,nop,TS val 184390069 ecr 795329041], length 1297
17:08:01.119571 tun0  Out IP 10.66.220.77.44138 > 104.18.12.136.443: Flags [.], ack 2626, win 502, options [nop,nop,TS val 795329279 ecr 184390069], length 0
17:08:01.125541 tun0  Out IP 10.66.220.77.44138 > 104.18.12.136.443: Flags [P.], seq 378:1836, ack 2626, win 502, options [nop,nop,TS val 795329285 ecr 184390069], length 1458
17:08:01.268389 tun0  In  IP 104.18.12.136.443 > 10.66.220.77.44108: Flags [F.], seq 546889116, ack 3999537703, win 8, options [nop,nop,TS val 2502671516 ecr 795314485,nop,nop,sack 1 {1329:1460}], length 0
17:08:01.268435 tun0  Out IP 10.66.220.77.44108 > 104.18.12.136.443: Flags [.], ack 1, win 502, options [nop,nop,TS val 795329427 ecr 2502671516], length 0
17:08:01.350915 tun0  In  IP 104.18.12.136.443 > 10.66.220.77.44138: Flags [.], ack 378, win 8, options [nop,nop,TS val 184390300 ecr 795329279,nop,nop,sack 1 {1706:1836}], length 0
17:08:01.420107 tun0  Out IP 10.66.220.77.44138 > 104.18.12.136.443: Flags [.], seq 378:1706, ack 2626, win 502, options [nop,nop,TS val 795329579 ecr 184390300], length 1328
17:08:01.704111 tun0  Out IP 10.66.220.77.44108 > 104.18.12.136.443: Flags [.], seq 1:1329, ack 1, win 502, options [nop,nop,TS val 795329863 ecr 2502671516], length 1328
17:08:02.376101 tun0  Out IP 10.66.220.77.44138 > 104.18.12.136.443: Flags [.], seq 378:1706, ack 2626, win 502, options [nop,nop,TS val 795330535 ecr 184390300], length 1328
17:08:04.296091 tun0  Out IP 10.66.220.77.44138 > 104.18.12.136.443: Flags [.], seq 378:1706, ack 2626, win 502, options [nop,nop,TS val 795332455 ecr 184390300], length 1328
17:08:08.104105 tun0  Out IP 10.66.220.77.44138 > 104.18.12.136.443: Flags [.], seq 378:1706, ack 2626, win 502, options [nop,nop,TS val 795336263 ecr 184390300], length 1328
17:08:14.248097 tun0  Out IP 10.66.220.77.44108 > 104.18.12.136.443: Flags [.], seq 1:1329, ack 1, win 502, options [nop,nop,TS val 795342407 ecr 2502671516], length 1328
17:08:15.784125 tun0  Out IP 10.66.220.77.44138 > 104.18.12.136.443: Flags [.], seq 378:1706, ack 2626, win 502, options [nop,nop,TS val 795343943 ecr 184390300], length 1328
17:08:16.076913 tun0  In  IP 104.18.12.136.443 > 10.66.220.77.44138: Flags [F.], seq 2626, ack 378, win 8, options [nop,nop,TS val 184405050 ecr 795329279,nop,nop,sack 1 {1706:1836}], length 0
17:08:16.078023 tun0  Out IP 10.66.220.77.44138 > 104.18.12.136.443: Flags [F.], seq 1836, ack 2627, win 502, options [nop,nop,TS val 795344237 ecr 184405050], length 0
17:08:16.315012 tun0  In  IP 104.18.12.136.443 > 10.66.220.77.44138: Flags [R], seq 1660488209, win 0, length 0
17:08:40.104114 tun0  Out IP 10.66.220.77.44108 > 104.18.12.136.443: Flags [.], seq 1:1329, ack 1, win 502, options [nop,nop,TS val 795368263 ecr 2502671516], length 1328
^C
24 packets captured
24 packets received by filter
0 packets dropped by kernel
```
ifconfig on gluetun:
```
# ifconfig
eth0      Link encap:Ethernet  HWaddr 02:42:C0:A8:D0:02  
          inet addr:192.168.208.2  Bcast:192.168.223.255  Mask:255.255.240.0
          inet6 addr: fe80::42:c0ff:fea8:d002/64 Scope:Link
          UP BROADCAST RUNNING MULTICAST  MTU:1500  Metric:1
          RX packets:8654 errors:0 dropped:0 overruns:0 frame:0
          TX packets:6167 errors:0 dropped:0 overruns:0 carrier:0
          collisions:0 txqueuelen:0 
          RX bytes:9890566 (9.4 MiB)  TX bytes:1029595 (1005.4 KiB)

lo        Link encap:Local Loopback  
          inet addr:127.0.0.1  Mask:255.0.0.0
          inet6 addr: ::1/128 Scope:Host
          UP LOOPBACK RUNNING  MTU:65536  Metric:1
          RX packets:4927 errors:0 dropped:0 overruns:0 frame:0
          TX packets:4927 errors:0 dropped:0 overruns:0 carrier:0
          collisions:0 txqueuelen:1000 
          RX bytes:390124 (380.9 KiB)  TX bytes:390124 (380.9 KiB)

tun0      Link encap:UNSPEC  HWaddr 00-00-00-00-00-00-00-00-00-00-00-00-00-00-00-00  
          inet addr:10.66.220.77  P-t-P:10.66.220.77  Mask:255.255.255.255
          inet6 addr: fc00:bbbb:bbbb:bb01::3:dc4c/128 Scope:Global
          UP POINTOPOINT RUNNING NOARP  MTU:1380  Metric:1
          RX packets:8110 errors:0 dropped:0 overruns:0 frame:0
          TX packets:5739 errors:0 dropped:0 overruns:0 carrier:0
          collisions:0 txqueuelen:0 
          RX bytes:9435240 (8.9 MiB)  TX bytes:740696 (723.3 KiB)
```
ifconfig on agnai:
```
/app# ifconfig
eth0: flags=4163<UP,BROADCAST,RUNNING,MULTICAST>  mtu 1500
        inet 192.168.208.2  netmask 255.255.240.0  broadcast 192.168.223.255
        inet6 fe80::42:c0ff:fea8:d002  prefixlen 64  scopeid 0x20<link>
        ether 02:42:c0:a8:d0:02  txqueuelen 0  (Ethernet)
        RX packets 15575  bytes 19779356 (18.8 MiB)
        RX errors 0  dropped 0  overruns 0  frame 0
        TX packets 10359  bytes 1627047 (1.5 MiB)
        TX errors 0  dropped 0 overruns 0  carrier 0  collisions 0

lo: flags=73<UP,LOOPBACK,RUNNING>  mtu 65536
        inet 127.0.0.1  netmask 255.0.0.0
        inet6 ::1  prefixlen 128  scopeid 0x10<host>
        loop  txqueuelen 1000  (Local Loopback)
        RX packets 5281  bytes 416328 (406.5 KiB)
        RX errors 0  dropped 0  overruns 0  frame 0
        TX packets 5281  bytes 416328 (406.5 KiB)
        TX errors 0  dropped 0 overruns 0  carrier 0  collisions 0

tun0: flags=209<UP,POINTOPOINT,RUNNING,NOARP>  mtu 1380
        inet 10.66.220.77  netmask 255.255.255.255  destination 10.66.220.77
        inet6 fc00:bbbb:bbbb:bb01::3:dc4c  prefixlen 128  scopeid 0x0<global>
        unspec 00-00-00-00-00-00-00-00-00-00-00-00-00-00-00-00  txqueuelen 0  (UNSPEC)
        RX packets 15016  bytes 19032788 (18.1 MiB)
        RX errors 0  dropped 0  overruns 0  frame 0
        TX packets 9920  bytes 1162012 (1.1 MiB)
        TX errors 0  dropped 0 overruns 0  carrier 0  collisions 0
```

-----
Run 2: boosting up gluetun mtu

Dump on gluetun:
```
# tcpdump -i any tcp and host 104.18.12.136
tcpdump: data link type LINUX_SLL2
tcpdump: verbose output suppressed, use -v[v]... for full protocol decode
listening on any, link-type LINUX_SLL2 (Linux cooked v2), snapshot length 262144 bytes
17:14:10.297424 tun0  Out IP 10.66.220.77.44518 > 104.18.12.136.443: Flags [S], seq 1299225179, win 65120, options [mss 1760,sackOK,TS val 795698456 ecr 0,nop,wscale 7], length 0
17:14:10.548959 tun0  In  IP 104.18.12.136.443 > 10.66.220.77.44518: Flags [S.], seq 304076163, ack 1299225180, win 65160, options [mss 1380,sackOK,TS val 4034343487 ecr 795698456,nop,wscale 13], length 0
17:14:10.548996 tun0  Out IP 10.66.220.77.44518 > 104.18.12.136.443: Flags [.], ack 1, win 509, options [nop,nop,TS val 795698708 ecr 4034343487], length 0
17:14:10.549708 tun0  Out IP 10.66.220.77.44518 > 104.18.12.136.443: Flags [P.], seq 1:378, ack 1, win 509, options [nop,nop,TS val 795698709 ecr 4034343487], length 377
17:14:10.796116 tun0  In  IP 104.18.12.136.443 > 10.66.220.77.44518: Flags [.], ack 378, win 8, options [nop,nop,TS val 4034343735 ecr 795698709], length 0
17:14:10.796524 tun0  In  IP 104.18.12.136.443 > 10.66.220.77.44518: Flags [.], seq 1:1369, ack 378, win 8, options [nop,nop,TS val 4034343739 ecr 795698709], length 1368
17:14:10.796547 tun0  Out IP 10.66.220.77.44518 > 104.18.12.136.443: Flags [.], ack 1369, win 499, options [nop,nop,TS val 795698956 ecr 4034343739], length 0
17:14:10.796579 tun0  In  IP 104.18.12.136.443 > 10.66.220.77.44518: Flags [P.], seq 1369:2627, ack 378, win 8, options [nop,nop,TS val 4034343739 ecr 795698709], length 1258
17:14:10.796598 tun0  Out IP 10.66.220.77.44518 > 104.18.12.136.443: Flags [.], ack 2627, win 497, options [nop,nop,TS val 795698956 ecr 4034343739], length 0
17:14:10.802330 tun0  Out IP 10.66.220.77.44518 > 104.18.12.136.443: Flags [P.], seq 378:1836, ack 2627, win 499, options [nop,nop,TS val 795698961 ecr 4034343739], length 1458
17:14:11.032504 tun0  In  IP 104.18.12.136.443 > 10.66.220.77.44518: Flags [.], ack 378, win 8, options [nop,nop,TS val 4034343998 ecr 795698956,nop,nop,sack 1 {1746:1836}], length 0
17:14:11.104080 tun0  Out IP 10.66.220.77.44518 > 104.18.12.136.443: Flags [.], seq 378:1746, ack 2627, win 499, options [nop,nop,TS val 795699263 ecr 4034343998], length 1368
17:14:11.880110 tun0  Out IP 10.66.220.77.44518 > 104.18.12.136.443: Flags [.], seq 378:1746, ack 2627, win 499, options [nop,nop,TS val 795700039 ecr 4034343998], length 1368
17:14:13.416116 tun0  Out IP 10.66.220.77.44518 > 104.18.12.136.443: Flags [.], seq 378:1746, ack 2627, win 499, options [nop,nop,TS val 795701575 ecr 4034343998], length 1368
17:14:16.488096 tun0  Out IP 10.66.220.77.44518 > 104.18.12.136.443: Flags [.], seq 378:1746, ack 2627, win 499, options [nop,nop,TS val 795704647 ecr 4034343998], length 1368
17:14:22.632036 tun0  Out IP 10.66.220.77.44518 > 104.18.12.136.443: Flags [.], seq 378:1746, ack 2627, win 499, options [nop,nop,TS val 795710791 ecr 4034343998], length 1368
17:14:25.831153 tun0  In  IP 104.18.12.136.443 > 10.66.220.77.44518: Flags [F.], seq 2627, ack 378, win 8, options [nop,nop,TS val 4034358726 ecr 795698956,nop,nop,sack 1 {1746:1836}], length 0
17:14:25.831558 tun0  Out IP 10.66.220.77.44518 > 104.18.12.136.443: Flags [F.], seq 1836, ack 2628, win 499, options [nop,nop,TS val 795713991 ecr 4034358726], length 0
17:14:26.075189 tun0  In  IP 104.18.12.136.443 > 10.66.220.77.44518: Flags [R], seq 304078791, win 0, length 0
^C
19 packets captured
19 packets received by filter
0 packets dropped by kernel
```
ifconfig on gluetun:
```
# ifconfig
eth0      Link encap:Ethernet  HWaddr 02:42:C0:A8:D0:02  
          inet addr:192.168.208.2  Bcast:192.168.223.255  Mask:255.255.240.0
          inet6 addr: fe80::42:c0ff:fea8:d002/64 Scope:Link
          UP BROADCAST RUNNING MULTICAST  MTU:1800  Metric:1
          RX packets:15776 errors:0 dropped:0 overruns:0 frame:0
          TX packets:10639 errors:0 dropped:0 overruns:0 carrier:0
          collisions:0 txqueuelen:0 
          RX bytes:19842673 (18.9 MiB)  TX bytes:1675409 (1.5 MiB)

lo        Link encap:Local Loopback  
          inet addr:127.0.0.1  Mask:255.0.0.0
          inet6 addr: ::1/128 Scope:Host
          UP LOOPBACK RUNNING  MTU:65536  Metric:1
          RX packets:6035 errors:0 dropped:0 overruns:0 frame:0
          TX packets:6035 errors:0 dropped:0 overruns:0 carrier:0
          collisions:0 txqueuelen:1000 
          RX bytes:475471 (464.3 KiB)  TX bytes:475471 (464.3 KiB)

tun0      Link encap:UNSPEC  HWaddr 00-00-00-00-00-00-00-00-00-00-00-00-00-00-00-00  
          inet addr:10.66.220.77  P-t-P:10.66.220.77  Mask:255.255.255.255
          inet6 addr: fc00:bbbb:bbbb:bb01::3:dc4c/128 Scope:Global
          UP POINTOPOINT RUNNING NOARP  MTU:1800  Metric:1
          RX packets:15166 errors:0 dropped:0 overruns:0 frame:0
          TX packets:10152 errors:0 dropped:0 overruns:0 carrier:0
          collisions:0 txqueuelen:0 
          RX bytes:19079680 (18.1 MiB)  TX bytes:1195652 (1.1 MiB)
```
ifconfig on agnai:
(same as before)

Agnai logs are simply showing the "socket hang up" message.

**Comment by sandwichdoge** [comment]
@BasadoBased 
I managed to replicate your setup, except I'm using NordVPN. It works without fail on my end (I went into agnai container, curl ifconfig.io and got the VPN-assigned public IP address, made requests to OpenAI and Scale, they all went through). I don't know why your connection keeps sending packets whose payload bigger than the TCP MSS, that doesn't happen to me when I check my own tcpdump log.
Here's my setup for reference, no additional tinkering was done:
```
version: '3'

services:
  gluetun:
    image: qmcgaw/gluetun
    cap_add:
      - NET_ADMIN
    environment:
      - VPN_SERVICE_PROVIDER=nordvpn
      - OPENVPN_USER=XXXXX
      - OPENVPN_PASSWORD=XXXXX
      - SERVER_REGIONS=Netherlands
    ports:
      - '3001:3001'
      
  app:
    image: ghcr.io/luminai-companion/agnaistic:latest
    restart: always
    environment:
      - DB_HOST=mongo
      - DB_PORT=27017
      - DB_NAME=agnai
      - INITIAL_USER=admin
      - INITIAL_PASSWORD=password
      - JWT_SECRET=self-hosting
    network_mode: service:gluetun

  mongo:
    image: mongo:6
    restart: always
    ports:
      - '27017:27017'
```

**Comment by BasadoBased** [comment]
Understood, thanks for the effort in looking into this. Since it's something specific to me I'm closing this. Unfortunately my setup is pretty standard so I don't know where to go from here.

**Comment by BasadoBased** [comment]
I fixed it at long last. I can confirm that it had nothing to do with this program. I put a generic container in the vpn network and ran Tavern out of it and basically had the same problem, so that clued me in to the actual problem. To fix it I had to switch gluetun to OpenVPN to access it's mss-fix option. Setting it to 1100 fixed the issues. Setting the mtu manually in both gluetun and the app container and the server were not enough to fix it. I basically tried everything else before this and this was the thing that fixed it. Cheers
